{
  "category_id": 1790,
  "listing_id": 1102039,
  "category_path": "Business_Services/Contract_Manufacturing",
  "url": "https://personalcaresuppliers.com/Listing/Index/Business_Services/Contract_Manufacturing/1790/1102039",
  "company_name": "Accupac",
  "address": "1501 Industrial Blvd. Mainland, PA 19451",
  "country": "United States",
  "phone": "215-256-7000",
  "has_website": true,
  "description": "Contract manufacturer and formulation lab for beauty and personal care brands",
  "specializations": [
    "Contract Manufacturing",
    "Formulation Lab",
    "Beauty Products",
    "Personal Care"
  ],
  "badges": [
    "Featured Listing",
    "Company Profile"
  ],
  "status": "active",
  "date_added": "2025-11-03",
  "schema_version": "1.0",
  "date_updated": "2025-11-03",
  "metadata": {
    "last_validated": "2025-11-03",
    "validation_method": "manual",
    "data_source": "manual_entry"
  },
  "tags": [
    "contract-manufacturer"
  ]
}
