{
  "category_id": 1828,
  "listing_id": "lucas_meyer_cosmetics",
  "category_path": "Raw_Materials/Actives",
  "url": "https://personalcaresuppliers.com/Listing/Index/Raw_Materials/Actives/1828/",
  "company_name": "Lucas Meyer Cosmetics",
  "parent_company": "Clariant",
  "address": "Z.A. Les Belles Fontaines, 99 route de Versailles, 91160 Champlan",
  "country": "France",
  "phone": "33169106969",
  "website": "https://www.lucasmeyercosmetics.com",
  "specializations": [
    "Cosmetic Active Ingredients",
    "Functional Ingredients",
    "Natural Ingredients",
    "Marine-Derived Actives",
    "Plant-Based Actives"
  ],
  "product_highlights": [
    "Borēaline® Aurora - Latest active ingredient for skin illumination",
    "Aldavine™ 5X - Highly potent active from unique polysaccharides derived from algae",
    "High-value unique cosmetic actives",
    "Functional ingredients for skin enhancement"
  ],
  "key_benefits": [
    "Enhance skin's natural strengths and beauty",
    "Skin illumination",
    "High potency actives",
    "Natural origin ingredients"
  ],
  "status": "active",
  "date_added": "2025-11-03",
  "notes": "Part of Clariant Group. Specializes in high-value, unique cosmetic active and functional ingredients. Focus on enhancing skin's own natural strengths and beauty. Strong portfolio of marine and plant-based actives.",
  "schema_version": "1.0",
  "date_updated": "2025-11-03",
  "metadata": {
    "last_validated": "2025-11-03",
    "validation_method": "manual",
    "data_source": "manual_entry"
  },
  "tags": [
    "major-player",
    "natural-ingredients"
  ]
}
