{
  "category_id": 1790,
  "listing_id": "vitelle_labs",
  "category_path": "Business_Services/Contract_Manufacturing",
  "url": "https://personalcaresuppliers.com/Listing/Index/Business_Services/Contract_Manufacturing/1790/",
  "company_name": "Vitelle Labs",
  "website": "https://www.vitellelab.com",
  "country": "North America",
  "specializations": [
    "Private Label Skincare",
    "Custom Formulation",
    "Contract Manufacturing",
    "Professional Skincare",
    "Premium Products"
  ],
  "services": [
    "Private label manufacturing",
    "Custom formulation development",
    "Contract manufacturing",
    "Professional skincare production"
  ],
  "key_benefits": [
    "Premium quality products",
    "Professional skincare focus",
    "Custom formulation expertise",
    "North American manufacturing"
  ],
  "status": "active",
  "date_added": "2025-11-03",
  "notes": "One of a handful of North American manufacturers offering premium private label and contract manufacturing services to the professional skincare industry. Focus on high-quality, professional-grade products.",
  "schema_version": "1.0",
  "date_updated": "2025-11-03",
  "metadata": {
    "last_validated": "2025-11-03",
    "validation_method": "manual",
    "data_source": "manual_entry"
  },
  "tags": [
    "contract-manufacturer"
  ]
}
