{
  "category_id": 1828,
  "listing_id": "solabia",
  "category_path": "Raw_Materials/Actives",
  "url": "https://personalcaresuppliers.com/Listing/Index/Raw_Materials/Actives/1828/",
  "company_name": "Solabia",
  "address": "29 rue Delizy, 93698 Pantin Cedex",
  "country": "France",
  "phone": "33-14-8101-940",
  "website": "https://www.solabia.com/cosmetics/",
  "specializations": [
    "Natural Cosmetic Ingredients",
    "Active Ingredients",
    "Functional Ingredients",
    "Nature-Inspired Ingredients",
    "Made in France",
    "Organic Certified Ingredients"
  ],
  "product_highlights": [
    "3Dermilyn®",
    "Ageraline® BGV",
    "Applecare™ A-100",
    "Applecare™ PDS 300",
    "Aquaregul-K®",
    "Asparlyne®",
    "AstaPure® Skin+",
    "Sleeping Beauty Collection - Certified organic passionflower from Landes forest"
  ],
  "certifications": [
    "Organic certified ingredients available",
    "Made in France"
  ],
  "manufacturing_facilities": [
    "5 production sites throughout France"
  ],
  "key_benefits": [
    "Nature-inspired ingredients",
    "Cutting-edge technologies",
    "Consistent quality",
    "Self-care and wellness focus"
  ],
  "status": "active",
  "date_added": "2025-11-03",
  "notes": "Key player in cosmetics industry. French group with 5 production sites throughout France offering Made in France ingredients. Combines nature and technology. Focus on ingredients inspired by nature and enhanced by cutting-edge technologies. Strong portfolio of actives and functional ingredients.",
  "schema_version": "1.0",
  "date_updated": "2025-11-03",
  "metadata": {
    "last_validated": "2025-11-03",
    "validation_method": "manual",
    "data_source": "manual_entry"
  },
  "tags": [
    "major-player",
    "organic",
    "natural-ingredients",
    "certified"
  ]
}
