{
  "schema_version": "1.0",
  "category_id": 1828,
  "listing_id": "sabinsa_corporation",
  "category_path": "Raw_Materials/Botanical_Extracts",
  "url": "https://personalcaresuppliers.com/Listing/Index/Raw_Materials/Botanical_Extracts/1828/",
  "status": "active",
  "date_added": "2025-11-04",
  "date_updated": "2025-11-04",
  "company_name": "Sabinsa Corporation",
  "address": "750 S. Innovation Circle, Payson, UT 84651",
  "country": "United States",
  "phone": "732-777-1111",
  "website": "https://www.sabinsa.com",
  "specializations": [
    "Over 120 standardized botanical extracts",
    "Patented botanical extracts",
    "Herbal ingredients",
    "Standardized actives",
    "Cosmeceutical ingredients",
    "Natural bioactive compounds"
  ],
  "tags": [
    "major-player",
    "natural-ingredients",
    "certified",
    "biotechnology"
  ],
  "certifications": [
    "Herbal Industry Leader Award",
    "American Botanical Council recognition",
    "GMP certified",
    "ISO certified"
  ],
  "product_highlights": [
    "120+ standardized botanical extracts portfolio",
    "Patented botanical extract technologies",
    "Global distribution in 17 countries",
    "Cosmeceutical-grade ingredients",
    "Research and development capabilities",
    "Vertical integration from sourcing to manufacturing"
  ],
  "key_benefits": [
    "Extensive standardized extract portfolio",
    "Patented ingredient innovations",
    "Global market presence",
    "Quality assurance and standardization",
    "Scientific research backing",
    "Reliable supply chain"
  ],
  "notes": "Major global player in botanical extracts with over 120 standardized botanical extracts. Industry leader recognized by American Botanical Council. Markets products in 17 countries worldwide. Focus on patented technologies and standardized high-quality extracts for cosmeceutical applications.",
  "metadata": {
    "last_validated": "2025-11-04",
    "validation_method": "manual",
    "data_source": "manual_entry"
  }
}
