{
  "schema_version": "1.0",
  "category_id": 1828,
  "listing_id": "croda_international",
  "category_path": "Raw_Materials/Emollients_Moisturizers",
  "url": "https://personalcaresuppliers.com/Listing/Index/Raw_Materials/Emollients_Moisturizers/1828/",
  "company_name": "Croda International",
  "status": "active",
  "date_added": "2025-11-04",
  "date_updated": "2025-11-04",
  "country": "United Kingdom",
  "specializations": [
    "Emollients",
    "Specialty chemicals",
    "High-performance personal care ingredients",
    "Sustainable ingredients",
    "Innovation"
  ],
  "product_highlights": [
    "Top 10 cosmetic raw material supplier globally",
    "High-performance emollients portfolio",
    "Sustainability-focused ingredient development",
    "Advanced specialty chemicals"
  ],
  "tags": ["major-player", "sustainable", "global-distributor"],
  "certifications": ["Sustainable sourcing"],
  "metadata": {
    "last_validated": "2025-11-04",
    "validation_method": "manual",
    "data_source": "manual_entry"
  },
  "notes": "Top 10 cosmetic raw material supplier, major player specializing in sustainable, high-performance emollients and specialty chemicals"
}
